SQL> select * from actors;

  ACTOR_ID ACTOR_NAME                               ACTOR_YEAR                  
---------- ---------------------------------------- ----------                  
         1 Энн Хэтэуэй                                    1982                  
         2 Скарлетт Йоханссон                             1984                  
         3 Фредди Хаймор                                  1992                  
         4 Эмилия Кларк                                   1986                  
         5 Крис Хемсворт                                  1983                  
         6 Кит Харингтон                                  1986                  
         7 Крис Эванс                                     1981                  
         8 Николас Гонсалес                               1976                  
         9 Хелена Бонэм Картер                            1966                  
        10 Роберт Дауни-младший                           1965                  
        11 Софи Тернер                                    1996                  

  ACTOR_ID ACTOR_NAME                               ACTOR_YEAR                  
---------- ---------------------------------------- ----------                  
        12 Марк Руффало                                   1967                  
        13 Джон Депп                                      1963                  
        14 Том Хиддлстон                                  1981                  
        15 Сэмюэл Л. Джексон                              1948                  

15 rows selected.

SQL> select * from movies;

  MOVIE_ID MOVIE_NAME                                    MOVIE_YEAR MOVIE_BUDGET
---------- --------------------------------------------- ---------- ------------
         1 Хороший доктор                                      2015      6000000
         2 Шоколадная фабрика                                  2005    150000000
         3 Алиса в стране чудес                                2010    200000000
         4 Дневники принцессы                                  2001     26000000
         5 Однажды                                             2011     15000000
         6 Игра престолов                                      2010     60000000
         7 Прошлым Рождеством                                  2019     25000000
         8 Я перед тобой                                       2016     20000000
         9 Мстители                                            2012    220000000

9 rows selected.

SQL> select actor_name, actor_year from actors
  2  where actor_year > (select actor_year from actors where actor_name ='Энн Хэтэуэй');

ACTOR_NAME                               ACTOR_YEAR                             
---------------------------------------- ----------                             
Скарлетт Йоханссон                             1984                             
Фредди Хаймор                                  1992                             
Эмилия Кларк                                   1986                             
Крис Хемсворт                                  1983                             
Кит Харингтон                                  1986                             
Софи Тернер                                    1996                             

6 rows selected.

SQL> SELECT Review FROM Reviews
  2  WHERE Movie_id IN (SELECT Movie_id FROM Movies WHERE Movie_budget > 10000000 );

REVIEW                                                                          
----------------------------------------                                        
отлично                                                                         
Неплохо                                                                         
Это лучший фильм                                                                
Фантазия                                                                        
Хорошо                                                                          
Хорошо                                                                          

6 rows selected.

SQL> SELECT Movies.Movie_name, Episodes.Episode_name FROM Movies, Episodes
  2  WHERE Movies.Movie_id = Episodes.Movie_id;

MOVIE_NAME                                                                      
---------------------------------------------                                   
EPISODE_NAME                                                                    
----------------------------------------                                        
Хороший доктор                                                                  
Сожженная еда                                                                   
                                                                                
Хороший доктор                                                                  
Оливер                                                                          
                                                                                
Хороший доктор                                                                  
трубы                                                                           
                                                                                

MOVIE_NAME                                                                      
---------------------------------------------                                   
EPISODE_NAME                                                                    
----------------------------------------                                        
Хороший доктор                                                                  
Не подделка                                                                     
                                                                                
Игра престолов                                                                  
зима близко                                                                     
                                                                                
Игра престолов                                                                  
Королевская дорога                                                              
                                                                                

MOVIE_NAME                                                                      
---------------------------------------------                                   
EPISODE_NAME                                                                    
----------------------------------------                                        
Игра престолов                                                                  
Лорд сноу                                                                       
                                                                                
Игра престолов                                                                  
Золотая Корона                                                                  
                                                                                

8 rows selected.

SQL> SELECT Movie_name,Actor_name
  2  FROM Movies m, Actors a, Movies_actors ma
  3  WHERE m.Movie_id= ma. Movie_id and ma.Actor_id=a.Actor_id;

MOVIE_NAME                                                                      
---------------------------------------------                                   
ACTOR_NAME                                                                      
----------------------------------------                                        
Хороший доктор                                                                  
Фредди Хаймор                                                                   
                                                                                
Хороший доктор                                                                  
Николас Гонсалес                                                                
                                                                                
Шоколадная фабрика                                                              
Фредди Хаймор                                                                   
                                                                                

MOVIE_NAME                                                                      
---------------------------------------------                                   
ACTOR_NAME                                                                      
----------------------------------------                                        
Шоколадная фабрика                                                              
Джон Депп                                                                       
                                                                                
Алиса в стране чудес                                                            
Энн Хэтэуэй                                                                     
                                                                                
Алиса в стране чудес                                                            
Джон Депп                                                                       
                                                                                

MOVIE_NAME                                                                      
---------------------------------------------                                   
ACTOR_NAME                                                                      
----------------------------------------                                        
Дневники принцессы                                                              
Энн Хэтэуэй                                                                     
                                                                                
Игра престолов                                                                  
Эмилия Кларк                                                                    
                                                                                
Игра престолов                                                                  
Софи Тернер                                                                     
                                                                                

MOVIE_NAME                                                                      
---------------------------------------------                                   
ACTOR_NAME                                                                      
----------------------------------------                                        
Мстители                                                                        
Скарлетт Йоханссон                                                              
                                                                                
Мстители                                                                        
Крис Хемсворт                                                                   
                                                                                
Мстители                                                                        
Крис Эванс                                                                      
                                                                                

MOVIE_NAME                                                                      
---------------------------------------------                                   
ACTOR_NAME                                                                      
----------------------------------------                                        
Мстители                                                                        
Роберт Дауни-младший                                                            
                                                                                
Мстители                                                                        
Марк Руффало                                                                    
                                                                                
Мстители                                                                        
Том Хиддлстон                                                                   
                                                                                

MOVIE_NAME                                                                      
---------------------------------------------                                   
ACTOR_NAME                                                                      
----------------------------------------                                        
Мстители                                                                        
Сэмюэл Л. Джексон                                                               
                                                                                

16 rows selected.

SQL> SELECT Movies.Movie_name, Episodes.Episode_name, Reviews.Review
  2  FROM Reviews, Episodes, Movies
  3  WHERE Episodes.Episode_id = Reviews.Episode_id and Episodes.Movie_id = Movies.Movie_id;

MOVIE_NAME                                                                      
---------------------------------------------                                   
EPISODE_NAME                                                                    
----------------------------------------                                        
REVIEW                                                                          
----------------------------------------                                        
Хороший доктор                                                                  
Сожженная еда                                                                   
Хорошо                                                                          
                                                                                
Хороший доктор                                                                  
трубы                                                                           
Неплохо                                                                         

MOVIE_NAME                                                                      
---------------------------------------------                                   
EPISODE_NAME                                                                    
----------------------------------------                                        
REVIEW                                                                          
----------------------------------------                                        
                                                                                
Игра престолов                                                                  
Золотая Корона                                                                  
отлично  

SQL> alter table actors
  2  add boss_id number(3,0);

Table altered.

SQL> alter table actors
  2  add constraint FK foreign key (boss_id)
  3   references actors (actor_id);

Table altered.

SQL> update actors
  2  set boss_id=9
  3  where actor_id=1;

1 row updated.

SQL> select * from actors;

  ACTOR_ID ACTOR_NAME                               ACTOR_YEAR    BOSS_ID       
---------- ---------------------------------------- ---------- ----------       
         1 Энн Хэтэуэй                                    1982          9       
         2 Скарлетт Йоханссон                             1984                  
         3 Фредди Хаймор                                  1992                  
         4 Эмилия Кларк                                   1986                  
         5 Крис Хемсворт                                  1983                  
         6 Кит Харингтон                                  1986                  
         7 Крис Эванс                                     1981                  
         8 Николас Гонсалес                               1976                  
         9 Хелена Бонэм Картер                            1966                  
        10 Роберт Дауни-младший                           1965                  
        11 Софи Тернер                                    1996                  

  ACTOR_ID ACTOR_NAME                               ACTOR_YEAR    BOSS_ID       
---------- ---------------------------------------- ---------- ----------       
        12 Марк Руффало                                   1967                  
        13 Джон Депп                                      1963                  
        14 Том Хиддлстон                                  1981                  
        15 Сэмюэл Л. Джексон                              1948                  

15 rows selected.

SQL> update actors set boss_id=10 where actor_id=2;

1 row updated.

SQL> update actors set boss_id=12 where actor_id=3;

1 row updated.

SQL> update actors set boss_id=13 where actor_id=4;

1 row updated.

SQL> update actors set boss_id=12 where actor_id=5;

1 row updated.

SQL> update actors set boss_id=9 where actor_id=6;

1 row updated.

SQL> update actors set boss_id=10 where actor_id=7;

1 row updated.

SQL> update actors set boss_id=13 where actor_id=8;

1 row updated.

SQL> update actors set boss_id=15 where actor_id=9;

1 row updated.

SQL> update actors set boss_id=15 where actor_id=10;

1 row updated.

SQL> update actors set boss_id=9 where actor_id=11;

1 row updated.

SQL> update actors set boss_id=15 where actor_id=12;

1 row updated.

SQL> update actors set boss_id=15 where actor_id=13;

1 row updated.

SQL> update actors set boss_id=13 where actor_id=14;

1 row updated.

SQL> select* from actors;

  ACTOR_ID ACTOR_NAME                               ACTOR_YEAR    BOSS_ID       
---------- ---------------------------------------- ---------- ----------       
         1 Энн Хэтэуэй                                    1982          9       
         2 Скарлетт Йоханссон                             1984         10       
         3 Фредди Хаймор                                  1992         12       
         4 Эмилия Кларк                                   1986         13       
         5 Крис Хемсворт                                  1983         12       
         6 Кит Харингтон                                  1986          9       
         7 Крис Эванс                                     1981         10       
         8 Николас Гонсалес                               1976         13       
         9 Хелена Бонэм Картер                            1966         15       
        10 Роберт Дауни-младший                           1965         15       
        11 Софи Тернер                                    1996          9       

  ACTOR_ID ACTOR_NAME                               ACTOR_YEAR    BOSS_ID       
---------- ---------------------------------------- ---------- ----------       
        12 Марк Руффало                                   1967         15       
        13 Джон Депп                                      1963         15       
        14 Том Хиддлстон                                  1981         13       
        15 Сэмюэл Л. Джексон                              1948                  

15 rows selected.

SQL> select level,actor_id,actor_name
  2     from actors
  3   connect by prior actor_id=boss_id
  4     start with boss_id is null;

     LEVEL   ACTOR_ID ACTOR_NAME                                                
---------- ---------- ----------------------------------------                  
         1         15 Сэмюэл Л. Джексон                                         
         2          9 Хелена Бонэм Картер                                       
         3          1 Энн Хэтэуэй                                               
         3          6 Кит Харингтон                                             
         3         11 Софи Тернер                                               
         2         10 Роберт Дауни-младший                                      
         3          2 Скарлетт Йоханссон                                        
         3          7 Крис Эванс                                                
         2         12 Марк Руффало                                              
         3          3 Фредди Хаймор                                             
         3          5 Крис Хемсворт                                             

     LEVEL   ACTOR_ID ACTOR_NAME                                                
---------- ---------- ----------------------------------------                  
         2         13 Джон Депп                                                 
         3          4 Эмилия Кларк                                              
         3          8 Николас Гонсалес                                          
         3         14 Том Хиддлстон                                             

15 rows selected.

SQL> select actor_name, Sys_Connect_By_Path(actor_id,':') Path
  2  from actors
  3  connect by prior actor_id=boss_id
  4  start with boss_id is null;

ACTOR_NAME                                                                      
----------------------------------------                                        
PATH                                                                            
--------------------------------------------------------------------------------
Сэмюэл Л. Джексон                                                               
:15                                                                             
                                                                                
Хелена Бонэм Картер                                                             
:15:9                                                                           
                                                                                
Энн Хэтэуэй                                                                     
:15:9:1                                                                         
                                                                                

ACTOR_NAME                                                                      
----------------------------------------                                        
PATH                                                                            
--------------------------------------------------------------------------------
Кит Харингтон                                                                   
:15:9:6                                                                         
                                                                                
Софи Тернер                                                                     
:15:9:11                                                                        
                                                                                
Роберт Дауни-младший                                                            
:15:10                                                                          
                                                                                

ACTOR_NAME                                                                      
----------------------------------------                                        
PATH                                                                            
--------------------------------------------------------------------------------
Скарлетт Йоханссон                                                              
:15:10:2                                                                        
                                                                                
Крис Эванс                                                                      
:15:10:7                                                                        
                                                                                
Марк Руффало                                                                    
:15:12                                                                          
                                                                                

ACTOR_NAME                                                                      
----------------------------------------                                        
PATH                                                                            
--------------------------------------------------------------------------------
Фредди Хаймор                                                                   
:15:12:3                                                                        
                                                                                
Крис Хемсворт                                                                   
:15:12:5                                                                        
                                                                                
Джон Депп                                                                       
:15:13                                                                          
                                                                                

ACTOR_NAME                                                                      
----------------------------------------                                        
PATH                                                                            
--------------------------------------------------------------------------------
Эмилия Кларк                                                                    
:15:13:4                                                                        
                                                                                
Николас Гонсалес                                                                
:15:13:8                                                                        
                                                                                
Том Хиддлстон                                                                   
:15:13:14                                                                       
                                                                                

15 rows selected.

SQL> select movie_name, movie_budget,
  2  SUM(Movie_budget) OVER (ORDER BY Movie_year ROWS BETWEEN UNBOUNDED PRECEDING AND CURRENT ROW) as sum
  3  from movies;

MOVIE_NAME                                    MOVIE_BUDGET        SUM           
--------------------------------------------- ------------ ----------           
Дневники принцессы                                26000000   26000000           
Шоколадная фабрика                               150000000  176000000           
Игра престолов                                    60000000  236000000           
Алиса в стране чудес                             200000000  436000000           
Однажды                                           15000000  451000000           
Мстители                                         220000000  671000000           
Хороший доктор                                     6000000  677000000           
Я перед тобой                                     20000000  697000000           
Прошлым Рождеством                                25000000  722000000           

9 rows selected.

SQL> SELECT Movie_name,
  2         Movie_budget,
  3         RANK () OVER (ORDER BY Movie_budget) rank
  4    FROM movies
  5  ;

MOVIE_NAME                                    MOVIE_BUDGET       RANK           
--------------------------------------------- ------------ ----------           
Хороший доктор                                     6000000          1           
Однажды                                           15000000          2           
Я перед тобой                                     20000000          3           
Прошлым Рождеством                                25000000          4           
Дневники принцессы                                26000000          5           
Игра престолов                                    60000000          6           
Шоколадная фабрика                               150000000          7           
Алиса в стране чудес                             200000000          8           
Мстители                                         220000000          9           

9 rows selected.

SQL>  select movie_name, movie_budget,
  2  AVG(Movie_budget) OVER (ORDER BY Movie_year ROWS BETWEEN 1 PRECEDING AND 1 FOLLOWING) as avg
  3   from movies;

MOVIE_NAME                                    MOVIE_BUDGET        AVG           
--------------------------------------------- ------------ ----------           
Дневники принцессы                                26000000   88000000           
Шоколадная фабрика                               150000000 78666666.7           
Игра престолов                                    60000000  136666667           
Алиса в стране чудес                             200000000 91666666.7           
Однажды                                           15000000  145000000           
Мстители                                         220000000 80333333.3           
Хороший доктор                                     6000000   82000000           
Я перед тобой                                     20000000   17000000           
Прошлым Рождеством                                25000000   22500000           

9 rows selected.

SQL> SELECT level, actor_name, (2020 - actor_year) as age,
  2  RANK () OVER (PARTITION BY level ORDER BY age) rank
  3  FROM actors
  4  CONNECT BY PRIOR actor_id=boss_id
  5  START WITH boss_id IS null;
RANK () OVER (PARTITION BY level ORDER BY age) rank
                                          *
ERROR at line 2:
ORA-00904: "AGE": invalid identifier 


SQL> SELECT level, actor_name, (2020 - actor_year) as age,
  2  RANK () OVER (PARTITION BY level ORDER BY (2020 - actor_year)) rank
  3  FROM actors
  4  CONNECT BY PRIOR actor_id=boss_id
  5  START WITH boss_id IS null;

     LEVEL ACTOR_NAME                                      AGE       RANK       
---------- ---------------------------------------- ---------- ----------       
         1 Сэмюэл Л. Джексон                                72          1       
         2 Марк Руффало                                     53          1       
         2 Хелена Бонэм Картер                              54          2       
         2 Роберт Дауни-младший                             55          3       
         2 Джон Депп                                        57          4       
         3 Софи Тернер                                      24          1       
         3 Фредди Хаймор                                    28          2       
         3 Эмилия Кларк                                     34          3       
         3 Кит Харингтон                                    34          3       
         3 Скарлетт Йоханссон                               36          5       
         3 Крис Хемсворт                                    37          6       

     LEVEL ACTOR_NAME                                      AGE       RANK       
---------- ---------------------------------------- ---------- ----------       
         3 Энн Хэтэуэй                                      38          7       
         3 Том Хиддлстон                                    39          8       
         3 Крис Эванс                                       39          8       
         3 Николас Гонсалес                                 44         10       

15 rows selected.

SQL> spool off
